{
  "$schema": "https://json-schema.org/draft/2020-12/schema",
  "$id": "https://github.com/Project-Colony/Project-Colony-Resources/generated/colony.schema.json",
  "title": "colony.json",
  "description": "@generated by colony-tokens. DO NOT EDIT. The manifest a Project Colony repository ships at its root so the launcher can list and install it.",
  "type": "object",
  "properties": {
    "$schema": {
      "type": "string"
    },
    "name": {
      "type": "string",
      "minLength": 1,
      "description": "Display name in the launcher. May differ from the repository name: this is the only field the user actually reads."
    },
    "category": {
      "type": "string",
      "description": "Which section of the launcher files this program. Matched case-insensitively. Colony warns and ignores an unrecognized value, which files the program nowhere. Canonical values: development, graphics, network, office, multimedia, system, utility, security, game, other.",
      "enum": [
        "development",
        "graphics",
        "network",
        "office",
        "multimedia",
        "system",
        "utility",
        "utilities",
        "security",
        "game",
        "games",
        "other"
      ]
    },
    "platforms": {
      "type": "array",
      "description": "Leave empty to let Colony auto-detect from release asset names following the convention (linux: <repo>-linux, windows: <repo>-windows.exe, macos-x86: <repo>-macos-x86, macos: <repo>-macos). \"macos\" is Apple Silicon, \"macos-x86\" is Intel.",
      "items": {
        "enum": [
          "linux",
          "windows",
          "macos",
          "macos-x86"
        ]
      },
      "uniqueItems": true
    },
    "releaseFiles": {
      "type": "object",
      "description": "Explicit per-platform asset resolution. Only needed when the assets do not follow the naming convention, or when installing from an archive. If present, it must cover every declared platform.",
      "properties": {
        "linux": {
          "type": "object",
          "description": "Which asset to fetch for this platform, and how to treat it once downloaded.",
          "properties": {
            "tag": {
              "type": "string",
              "minLength": 1,
              "description": "A git tag, or the literal \"latest\" to always track the newest release."
            },
            "file": {
              "type": "string",
              "minLength": 1,
              "description": "Exact asset filename. Mutually exclusive with filePattern."
            },
            "filePattern": {
              "type": "string",
              "minLength": 1,
              "description": "Case-insensitive pattern matched against the release's asset names, for assets whose name carries the version. Must match exactly one asset."
            },
            "binary": {
              "type": "string",
              "minLength": 1,
              "description": "Binary to extract from inside the downloaded archive (.zip / .tar.gz). Omit when the downloaded file is itself the binary."
            },
            "sha256": {
              "type": "string",
              "pattern": "^[0-9a-f]{64}$",
              "description": "Optional SHA-256 of the asset, 64 lowercase hex characters."
            }
          },
          "required": [
            "tag"
          ],
          "additionalProperties": false,
          "oneOf": [
            {
              "required": [
                "file"
              ],
              "not": {
                "required": [
                  "filePattern"
                ]
              }
            },
            {
              "required": [
                "filePattern"
              ],
              "not": {
                "required": [
                  "file"
                ]
              }
            }
          ]
        },
        "windows": {
          "type": "object",
          "description": "Which asset to fetch for this platform, and how to treat it once downloaded.",
          "properties": {
            "tag": {
              "type": "string",
              "minLength": 1,
              "description": "A git tag, or the literal \"latest\" to always track the newest release."
            },
            "file": {
              "type": "string",
              "minLength": 1,
              "description": "Exact asset filename. Mutually exclusive with filePattern."
            },
            "filePattern": {
              "type": "string",
              "minLength": 1,
              "description": "Case-insensitive pattern matched against the release's asset names, for assets whose name carries the version. Must match exactly one asset."
            },
            "binary": {
              "type": "string",
              "minLength": 1,
              "description": "Binary to extract from inside the downloaded archive (.zip / .tar.gz). Omit when the downloaded file is itself the binary."
            },
            "sha256": {
              "type": "string",
              "pattern": "^[0-9a-f]{64}$",
              "description": "Optional SHA-256 of the asset, 64 lowercase hex characters."
            }
          },
          "required": [
            "tag"
          ],
          "additionalProperties": false,
          "oneOf": [
            {
              "required": [
                "file"
              ],
              "not": {
                "required": [
                  "filePattern"
                ]
              }
            },
            {
              "required": [
                "filePattern"
              ],
              "not": {
                "required": [
                  "file"
                ]
              }
            }
          ]
        },
        "macos": {
          "type": "object",
          "description": "Which asset to fetch for this platform, and how to treat it once downloaded.",
          "properties": {
            "tag": {
              "type": "string",
              "minLength": 1,
              "description": "A git tag, or the literal \"latest\" to always track the newest release."
            },
            "file": {
              "type": "string",
              "minLength": 1,
              "description": "Exact asset filename. Mutually exclusive with filePattern."
            },
            "filePattern": {
              "type": "string",
              "minLength": 1,
              "description": "Case-insensitive pattern matched against the release's asset names, for assets whose name carries the version. Must match exactly one asset."
            },
            "binary": {
              "type": "string",
              "minLength": 1,
              "description": "Binary to extract from inside the downloaded archive (.zip / .tar.gz). Omit when the downloaded file is itself the binary."
            },
            "sha256": {
              "type": "string",
              "pattern": "^[0-9a-f]{64}$",
              "description": "Optional SHA-256 of the asset, 64 lowercase hex characters."
            }
          },
          "required": [
            "tag"
          ],
          "additionalProperties": false,
          "oneOf": [
            {
              "required": [
                "file"
              ],
              "not": {
                "required": [
                  "filePattern"
                ]
              }
            },
            {
              "required": [
                "filePattern"
              ],
              "not": {
                "required": [
                  "file"
                ]
              }
            }
          ]
        },
        "macos-x86": {
          "type": "object",
          "description": "Which asset to fetch for this platform, and how to treat it once downloaded.",
          "properties": {
            "tag": {
              "type": "string",
              "minLength": 1,
              "description": "A git tag, or the literal \"latest\" to always track the newest release."
            },
            "file": {
              "type": "string",
              "minLength": 1,
              "description": "Exact asset filename. Mutually exclusive with filePattern."
            },
            "filePattern": {
              "type": "string",
              "minLength": 1,
              "description": "Case-insensitive pattern matched against the release's asset names, for assets whose name carries the version. Must match exactly one asset."
            },
            "binary": {
              "type": "string",
              "minLength": 1,
              "description": "Binary to extract from inside the downloaded archive (.zip / .tar.gz). Omit when the downloaded file is itself the binary."
            },
            "sha256": {
              "type": "string",
              "pattern": "^[0-9a-f]{64}$",
              "description": "Optional SHA-256 of the asset, 64 lowercase hex characters."
            }
          },
          "required": [
            "tag"
          ],
          "additionalProperties": false,
          "oneOf": [
            {
              "required": [
                "file"
              ],
              "not": {
                "required": [
                  "filePattern"
                ]
              }
            },
            {
              "required": [
                "filePattern"
              ],
              "not": {
                "required": [
                  "file"
                ]
              }
            }
          ]
        }
      },
      "additionalProperties": false
    },
    "icon": {
      "type": "string",
      "pattern": "^(?!/).*\\.(png|PNG)$",
      "description": "Repo-relative path to a square PNG. When absent, Colony probes icon.png at the repo root, then falls back to a category hexagon tinted by the program's name."
    },
    "signed": {
      "type": "boolean",
      "description": "Require a valid detached ed25519 signature for every asset. When true, a missing or invalid <asset>.sig aborts the install instead of falling back to the unsigned path."
    }
  },
  "required": [
    "name",
    "category"
  ],
  "additionalProperties": false
}
